{
  "definitions": {},
  "$schema": "http://json-schema.org/draft-07/schema#",
  "$id": "http://example.com/root.json",
  "type": "object",
  "title": "The Root Schema",
  "required": [
    "felles"
  ],
  "properties": {
    "felles": {
      "required": [
        "mottaker",
        "brevDato",
        "fritekst",
        "erVurdertAvNK"
      ],
      "properties": {
        "søkerNavn": {
          "type": "string"
        },
        "søkerId": {
          "type": "string"
        },
        "mottaker": {
          "required": [
            "navn",
            "id",
            "bruker"
          ],
          "properties": {
            "arbeidsgiver": {
              "type": "boolean"
            },
            "bruker": {
              "type": "boolean"
            },
            "navn": {
              "type": "string"
            },
            "id": {
              "type": "string"
            }
          }
        },

        "brevDato": {
          "type": "string"
        },
        "fritekst": {
          "type": "string"
        },
        "erVurdertAvNK": {
          "type": "boolean"
        }
      }
    },
    "ytelse": {
      "type": "string"
    },
    "avdeling": {
      "type": "string"
    },
    "flereÅrsaker": {
      "type": "boolean"
    },
    "aarsakKlagetForSent": {
      "type": "boolean"
    },
    "aarsakManglerUnderskrift": {
      "type": "boolean"
    },
    "aarsakIkkeEtVedtak": {
      "type": "boolean"
    },
    "aarsakVedtakGjelderIkkePart": {
      "type": "boolean"
    },
    "aarsakManglerKlagegrunn": {
      "type": "boolean"
    },
    "hjemler": {
      "type": "string"
    }
  }
}
