{
  "felles": {
    "hovedytelse": "OMSORGSPENGER",
    "brevnavn": "omsorgspenger",
    "brevDato": "1. mai 2020",
    "erVurdertAvNK": false,
    "mottaker": {
      "arbeidsgiver": false,
      "bruker": true,
      "navn": "Selv Sjeler",
      "id": "300220 12345"
    },
    "fritekst": "Vi mener at du forklart med denne friteksten har fått medhold"
  },
  "ytelse": "omsorgspenger",
  "avdeling": "NAV",
  "flereÅrsaker": true,
  "aarsakKlagetForSent": true,
  "aarsakManglerUnderskrift": true,
  "aarsakIkkeEtVedtak": true,
  "aarsakVedtakGjelderIkkePart": true,
  "aarsakManglerKlagegrunn": true,
  "hjemler": "Vedtaket er gjort etter folketrygdloven § 21-12 og forvaltningsloven §§ 31 og 34."
}